{
  "schemaVersion": 1,
  "kind": "sandbox-workbench-acceptance-v1",
  "gameBuild": 2545,
  "scope": "supplementary-offline-contracts",
  "scenarios": [
    {
      "id": "routing",
      "title": "One elected workbench host per accepted input edge",
      "fixture": "Deterministic offline contract, not observed game evidence: FakeModContext, CreatorWorkbenchRouter and two authenticated competing hosts; count actual callback invocations and snapshot registration identities before acquisition and after disposal. Positive equals/count exercise counters start at zero for each sample; their expected values count only that sample's exercised actions.",
      "requiredSamples": 1,
      "actions": [
        "Register a running Sandbox host and lower-priority competing host with the configurable shared binding.",
        "Dispatch one accepted synthetic input edge and independently count the elected callback; reject non-running, stale, headless and incompatible-host paths in separate negative fixtures.",
        "Dispose both registrations and dispatch the old binding again; measure callbacks and router registrations."
      ],
      "cleanup": [
        "Dispose registrations in reverse acquisition order, then the router and test context.",
        "Compare owned input and host registrations with the captured baseline; assert no fake context leaks."
      ],
      "negativeTests": [
        "Give both hosts a callback recorder: a second invocation from one edge must fail the count oracle.",
        "Retain a stale callback after unregistering its host and fail if it invokes the retired host.",
        "Exercise wrong gamemode, loading/stopping and simulated remote admission without treating a fake participant as native multiplayer."
      ],
      "oracles": [
        {
          "metric": "accepted-toggle-callbacks",
          "type": "count",
          "comparison": "equals",
          "expected": 1
        },
        {
          "metric": "retired-host-callbacks",
          "type": "count",
          "comparison": "equals",
          "expected": 0
        },
        {
          "metric": "owned-routing-state",
          "type": "fingerprint",
          "comparison": "unchanged",
          "expected": null
        }
      ],
      "residualRequirements": [
        {
          "id": "routing-native-f5",
          "lane": "os-input",
          "availability": "requires-environment",
          "oracle": "Send a real F5 down/up pair to the receipt-bound foreground game and correlate one elected Sandbox toggle with actual visibility.",
          "negativeTest": "Hold or duplicate the edge, lose foreground, or target the wrong process; abort actuation or detect duplicate/wrong toggles.",
          "cleanup": "Release all held keys and verify the original owned process and control baseline."
        },
        {
          "id": "routing-remote-session",
          "lane": "game",
          "availability": "not-implemented",
          "oracle": "A genuinely connected remote participant must exercise the declared host policy when a supported live transport exists.",
          "negativeTest": "A fake participant or local loopback must remain classified as offline, never a real remote pass.",
          "cleanup": "Disconnect only fixture-owned peers and verify session, registration and input cleanup."
        },
        {
          "id": "routing-usable-toggle",
          "lane": "human",
          "availability": "requires-human",
          "oracle": "Observe that the correct tool opens once, identifies its owner and can be closed through accessible controls.",
          "negativeTest": "Have the operator identify a wrong owner or visually duplicated surface independently of a callback count.",
          "cleanup": "Close fixture surfaces and confirm player control/cursor recovery."
        }
      ]
    },
    {
      "id": "catalog-editing",
      "title": "Catalog spawn, transform, duplicate and temporary visibility",
      "fixture": "Deterministic offline contract: one authenticated prop source and borrowed scene target through CreatorContentService or its testing fake; record actual factory/adapter calls, entity identity and owner-tagged roster state. Required counts specify fixture behavior only. Positive equals/count exercise counters start at zero for each sample; their expected values count only that sample's exercised actions.",
      "requiredSamples": 1,
      "actions": [
        "Browse and select the pinned source-qualified prop entry through captured workbench controls.",
        "Spawn one owned object, apply one transform, duplicate once and temporarily hide one borrowed target; independently observe four successful fixture operations.",
        "End the session and compare borrowed transform/visibility and foreign-owner objects with their pre-session snapshots."
      ],
      "cleanup": [
        "Restore borrowed edits before disposing owned objects and registrations.",
        "Dispose the source/session/context and verify the original borrowed-state fingerprint and resource baseline."
      ],
      "negativeTests": [
        "Remove the source or expected catalog entry before selection and require a bounded unavailable outcome.",
        "Return a foreign-owner duplicate recipe, a throwing factory or a partial transform failure; reject false success and release reservations.",
        "Seed one missing restore or retained duplicate and require the restoration or owned-count oracle to fail."
      ],
      "oracles": [
        {
          "metric": "completed-fixture-operations",
          "type": "count",
          "comparison": "equals",
          "expected": 4
        },
        {
          "metric": "retained-owned-objects",
          "type": "count",
          "comparison": "equals",
          "expected": 0
        },
        {
          "metric": "borrowed-and-foreign-state",
          "type": "fingerprint",
          "comparison": "unchanged",
          "expected": null
        }
      ],
      "residualRequirements": [
        {
          "id": "catalog-editor-controls",
          "lane": "editor",
          "availability": "requires-environment",
          "oracle": "Production widgets in the pinned Editor must expose the intended search, list, selection, transform, visibility and duplicate controls with usable hit regions.",
          "negativeTest": "Render a clipped or disabled required control and fail visual/semantic assertions despite successful controller calls.",
          "cleanup": "Dispose UI hosts, pooled elements and subscriptions to their measured baselines."
        },
        {
          "id": "catalog-native-inventory",
          "lane": "game",
          "availability": "requires-environment",
          "oracle": "Exercise every admitted item, prop and RobotKit type from the exact candidate inventory and inspect native identities, transforms, visibility and roster membership.",
          "negativeTest": "Omit an expected type or make the rendered selection disagree with the mutated native target; fail the mapped case.",
          "cleanup": "End the session and confirm owned native objects disappear while borrowed/foreign objects restore."
        },
        {
          "id": "catalog-keyboard-selection",
          "lane": "os-input",
          "availability": "requires-environment",
          "oracle": "Use real keyboard and pointer dispatch to search, select and edit through production hit regions.",
          "negativeTest": "Invoke a controller callback without matching focused control/input evidence and refuse a native UI claim.",
          "cleanup": "Release device input and restore the prior focus and player-control state."
        }
      ]
    },
    {
      "id": "borrowed-robot",
      "title": "Borrowed robot previews and conflict-aware restoration",
      "fixture": "Deterministic offline contract: FakeRobotSceneEditorService with a preexisting robot whose transform, personality fields/identity and brain data are independently snapshotable. The positive fixture has no external writer; conflict and disappearing-target behavior are separate negative fixtures. Positive equals/count exercise counters start at zero for each sample; their expected values count only that sample's exercised actions.",
      "requiredSamples": 1,
      "actions": [
        "Acquire one exclusive borrowed-robot edit lease.",
        "Apply one transform, one personality preview and one brain preview, independently checking three accepted mutations against the fake robot state.",
        "End the session and compare the non-conflicting robot snapshot with its baseline; inspect retained temporary objects and leases."
      ],
      "cleanup": [
        "Attempt every owned restoration even if another disposer throws, then release the edit reservation.",
        "Dispose workbench and fake context after recording the restoration result; retain external-writer state in the separate conflict fixture."
      ],
      "negativeTests": [
        "Write different robot state outside the lease after preview; require Conflict, preserved outside changes and visible failure propagation instead of a false restored message.",
        "Destroy the borrowed target or fail halfway through preview; require bounded failure and released ownership without resurrecting it.",
        "Seed a leaked temporary personality or stale brain snapshot and fail the independent state/resource oracle."
      ],
      "oracles": [
        {
          "metric": "accepted-preview-mutations",
          "type": "count",
          "comparison": "equals",
          "expected": 3
        },
        {
          "metric": "retained-temporary-personalities",
          "type": "count",
          "comparison": "equals",
          "expected": 0
        },
        {
          "metric": "borrowed-robot-state",
          "type": "fingerprint",
          "comparison": "unchanged",
          "expected": null
        },
        {